<?xml version="1.0" encoding="UTF-8"?>
<xs:schema xmlns:xs="http://www.w3.org/2001/XMLSchema">
    <xs:element name="clase">
        <xs:complexType>
        <xs:sequence>
    <xs:element name="estudiante" maxOccurs="unbounded">
        <xs:complexType>
        <xs:sequence>
    <xs:element name="nombre" type="xs:boolean"/>
    <xs:element name="edad" type="xs:float"/>
      <xs:element name="Municipio" type="xs:string"/>
        </xs:sequence>
        </xs:complexType>
    </xs:element>
        </xs:sequence>
        </xs:complexType>
    </xs:element>
</xs:schema>