<?xml version="1.0" encoding="UTF-8"?>
<clase xmlns:xsi="http://www.w3.org/2001/XMLSchema-instance"
xsi:noNamespaceSchemaLocation="clase.xsd">
    <estudiante>
        <nombre>1</nombre>
        <edad>20</edad>
        <Municipio>isla</Municipio>
    </estudiante>
    <estudiante>
        <nombre>0</nombre>
        <edad>22</edad>
        <Municipio>lepe</Municipio>
    </estudiante>
</clase>